{
  "recordId": "6f1c2a9e-3b7d-4e51-9a0c-2d8f5b1e7c34",
  "gameProfile": "mtg_commander",
  "startingLife": 40,
  "startedAtMs": 1793131200000,
  "durationMs": 3725000,
  "starter": 2,
  "winner": 0,
  "winners": [
    0
  ],
  "players": [
    {
      "name": "Ana, the \"Brave\"",
      "profileId": "C0DE1234",
      "localId": null,
      "finalLife": 35,
      "turnsCompleted": 0,
      "demerits": 0,
      "extensionsUsed": 0,
      "turnMs": 0,
      "fastestTurnMs": 0,
      "longestTurnMs": 0,
      "outOrder": null,
      "conceded": false,
      "eliminatedBy": null,
      "bagDrawn": false,
      "selfEliminated": false,
      "commanderDamageReceived": 0,
      "counters": {
        "poison": 0,
        "energy": 0,
        "experience": 0,
        "commanderCasts": [
          0,
          1
        ],
        "cityBlessing": false
      },
      "commanderBySource": {}
    },
    {
      "name": "Ben",
      "profileId": null,
      "localId": null,
      "finalLife": 19,
      "turnsCompleted": 0,
      "demerits": 0,
      "extensionsUsed": 0,
      "turnMs": 0,
      "fastestTurnMs": 0,
      "longestTurnMs": 0,
      "outOrder": 1,
      "conceded": false,
      "eliminatedBy": 0,
      "bagDrawn": false,
      "selfEliminated": false,
      "commanderDamageReceived": 21,
      "counters": {
        "poison": 0,
        "energy": 0,
        "experience": 0,
        "commanderCasts": [
          0,
          0
        ],
        "cityBlessing": false
      },
      "commanderBySource": {
        "0": [
          21,
          0
        ]
      }
    },
    {
      "name": "Cal",
      "profileId": null,
      "localId": null,
      "finalLife": 0,
      "turnsCompleted": 1,
      "demerits": 0,
      "extensionsUsed": 0,
      "turnMs": 30000,
      "fastestTurnMs": 30000,
      "longestTurnMs": 30000,
      "outOrder": 3,
      "conceded": false,
      "eliminatedBy": null,
      "bagDrawn": false,
      "selfEliminated": false,
      "commanderDamageReceived": 0,
      "counters": {
        "poison": 0,
        "energy": 0,
        "experience": 0,
        "commanderCasts": [
          0,
          0
        ],
        "cityBlessing": false
      },
      "commanderBySource": {}
    },
    {
      "name": "=Dee",
      "profileId": null,
      "localId": null,
      "finalLife": 40,
      "turnsCompleted": 0,
      "demerits": 0,
      "extensionsUsed": 0,
      "turnMs": 0,
      "fastestTurnMs": 0,
      "longestTurnMs": 0,
      "outOrder": 2,
      "conceded": true,
      "eliminatedBy": null,
      "bagDrawn": false,
      "selfEliminated": false,
      "commanderDamageReceived": 0,
      "counters": {
        "poison": 0,
        "energy": 0,
        "experience": 0,
        "commanderCasts": [
          0,
          0
        ],
        "cityBlessing": false
      },
      "commanderBySource": {}
    }
  ]
}
